{"schema_version":1,"artifact_id":"synthetic-binding-review-v1","artifact_created_wall_ns":1200000000,"binding_artifact_id":"synthetic-binding-manifest-v1","binding_artifact_sha256":"b39889f6c2a09d4eb39133274803e4fd3329c8a1fb3db5da19bdedf407260471","decision":"approved","reviewer_id":"synthetic-reviewer","reviewed_wall_ns":1100000000,"review_evidence_sha256":"d62660ca05a31c17301572e65a5209e81688638c0823b44c99b3f9abc165a156"}